{
  "$schema": "https://json-schema.org/draft/2020-12/schema",
  "title": "fitllm measured fixture",
  "description": "One real-world measurement: what a model ACTUALLY consumed on real hardware. Submitted via PR; cross-referenced by the Fit Census as predicted-vs-measured. Measurements are typed: measurementKind says WHAT was measured — resident weights and whole-system peak are different metrics and are compared against different predicted columns.",
  "type": "array",
  "items": {
    "type": "object",
    "required": ["model", "device", "quant", "ctx", "kvBits", "measuredPeakGB", "measurementKind", "runtime", "source", "date"],
    "properties": {
      "model": { "type": "string", "description": "Exact engine model name, e.g. 'GLM-4.7-Flash'" },
      "device": { "type": "string", "description": "Exact census device name, e.g. 'RTX 4090' or 'M5 Max 64GB'. Legacy exception: entries with unconfirmed hardware carry a descriptive string + measurementKind: unknown and intentionally do NOT join the census; new submissions must use exact names." },
      "quant": { "type": "string", "description": "GPU: Q4_K_M/Q5_K_M/Q6_K/Q8_0/FP16 · Mac: 4bit/8bit/16bit" },
      "ctx": { "type": "integer", "minimum": 1024, "description": "Context length actually loaded" },
      "kvBits": { "type": "integer", "enum": [16, 8, 4] },
      "measuredPeakGB": { "type": "number", "exclusiveMinimum": 0, "description": "Measured memory. GiB unless `unit` says otherwise. Field name is legacy — `measurementKind` says whether this is a peak or a resident floor." },
      "measurementKind": {
        "type": "string",
        "enum": ["idle_resident", "load_peak", "generation_peak", "system_total_peak", "allocation_floor", "unknown"],
        "description": "WHAT was measured. idle_resident = model weights resident with no active generation (a FLOOR; e.g. oMLX actual_size, ollama ps) — compare against predicted weights, NOT against predicted total. load_peak = peak during model load. generation_peak = peak during active generation. system_total_peak = whole-device memory peak incl. OS — the only kind directly comparable to fitllm's usedGB (total to run). allocation_floor = what the runtime itself reported allocating for the model — its logged buffers (weights, KV, state, compute) or a per-process GPU-memory snapshot (nvidia-smi); a FLOOR that leaves out whatever the source does not show (CUDA context, host memory) and any peak it did not sample — the prediction without OS share should not be below it, and a prediction above it is not by itself an error. unknown = legacy/unclear (new submissions should not use this)."
      },
      "unit": { "type": "string", "enum": ["GiB", "GB"], "description": "Unit of measuredPeakGB. GiB = 1024^3 bytes (what nvidia-smi/Activity Monitor/oMLX labels show), GB = 10^9. Omit if the source did not specify." },
      "includesOsReserve": { "type": "boolean", "description": "true only if the number includes OS/driver/display memory (whole-system measurements). Resident-weights readings are false." },
      "evidenceLevel": {
        "type": "string",
        "enum": ["maintainer_verified", "community_unverified"],
        "description": "maintainer_verified = independently checked by maintainers (physical consistency vs HF weight sizes, engine reproduction, raw artifacts). community_unverified = accepted as a plausible claim, not calibration-grade. Reports are claims until verified — engine constants never change on community_unverified evidence alone."
      },
      "reporter": { "type": "string", "description": "GitHub username of the person who TOOK the measurement. Must be the measurer — third-party relays of someone else's numbers are not accepted (issue #1 lesson)." },
      "runtime": { "type": "string", "description": "llama.cpp <version> / ollama <version> / mlx <version> / vllm <version> — version required for reproducibility. Legacy exception: entries whose original report omitted it carry 'unreported ...' and measurementKind: unknown; new submissions must include it." },
      "source": { "type": "string", "description": "URL of the PR or issue containing the full report" },
      "date": { "type": "string", "pattern": "^\\d{4}-\\d{2}-\\d{2}$" },
      "notes": { "type": "string" }
    }
  }
}
