[
  {
    "model": "Gemma 4 26b A4B",
    "device": "RTX 5060 Ti 16GB, Windows 11 (per reporter 2026-07-11; the 26.7 estimate was read off a 24GB Mac preset the reporter used as an approximation)",
    "quant": "4bit",
    "ctx": 32768,
    "kvBits": 16,
    "measuredPeakGB": 15.1,
    "measurementKind": "unknown",
    "runtime": "unreported (Windows box — MLX excluded; tool and which memory the 15.1 refers to, dedicated VRAM vs system RAM, both unknown)",
    "source": "https://github.com/click6067-ship-it/fitllm-engine/issues/1",
    "date": "2026-05-28",
    "notes": "Original report (2026-05-28): title said 24GB, body said 16GB VRAM, measured peak 15.1 GB, FitLLM estimate 26.7 (wont fit). Reconstruction on the engine revision deployed that day reproduces used=26.71 exactly for a 16GB or 24GB Mac preset at 4bit/32K (site was Apple-only until GPU mode shipped 2026-06-04). RESOLVED 2026-07-11 by the reporter: the machine was never a Mac — it is a Windows 11 box with an RTX 5060 Ti 16GB, and the 24GB Mac in the UI was the reporter's stand-in for it ('I approximated this with a 24gb Mac'). Consequences: (a) the 26.7-vs-15.1 headline is a cross-platform comparison — a Mac-preset total-footprint estimate vs a measurement on different hardware — and does not falsify the Mac verdict; (b) this entry is DISQUALIFIED as a small-Mac reserve calibration point (issue #8 tracker starts from zero candidates); (c) as a GPU data point it stays unusable until the runtime/tool and memory kind (VRAM vs system) are known. Audit trail: a third-party follow-up (2026-07-10) attributed this to an M5 Max 128GB via oMLX; contradicted by the 26.7 figure and reverted 2026-07-11.",
    "evidenceLevel": "community_unverified",
    "reporter": "itzpingcat"
  },
  {
    "model": "Qwen3-Coder-30B-A3B-Instruct-8bit",
    "device": "M5 Max 128GB",
    "quant": "8bit",
    "ctx": 32768,
    "kvBits": 16,
    "measuredPeakGB": 30.4,
    "measurementKind": "idle_resident",
    "unit": "GiB",
    "includesOsReserve": false,
    "runtime": "oMLX 0.4.5.dev1 (MLX 0.31.2)",
    "source": "https://github.com/click6067-ship-it/fitllm-engine/issues/2",
    "date": "2026-07-09",
    "notes": "Measured on M5 Max 128GB via the oMLX fork's /engine/loaded endpoint (actual resident bytes) — the same metric issue #2 used. Source figure 30.4 GiB is taken from the issue #2 table; not re-measured this session because the model was not resident at measurement time. oMLX reports estimated_size 31.72 GiB for the full 8-bit MoE weights, so 30.4 resident reflects dFlash SSD expert offload (active experts only). ctx=32768 and kvBits=16 are the oMLX defaults (max_context_window global default; unquantized fp16 KV) — the Coder was not loaded this session so its per-model ctx/KV settings were not directly re-read, but the 30.4 figure is weight-residency-dominated and effectively ctx-independent. Issue #2 is closed (parseHfConfig bit-width fix landed).",
    "evidenceLevel": "community_unverified",
    "reporter": "gilbert-barajas"
  },
  {
    "model": "Qwen3.6-27B-4bit",
    "device": "M5 Max 128GB",
    "quant": "4bit",
    "ctx": 32768,
    "kvBits": 16,
    "measuredPeakGB": 15.33,
    "measurementKind": "idle_resident",
    "unit": "GiB",
    "includesOsReserve": false,
    "runtime": "oMLX 0.4.5.dev1 (MLX 0.31.2)",
    "source": "https://github.com/click6067-ship-it/fitllm-engine/issues/2",
    "date": "2026-07-09",
    "notes": "Measured live this session from oMLX /admin/api/models -> Qwen3.6-27B-4bit.actual_size = 16,457,805,464 bytes = 15.33 GiB (oMLX's own formatted label). This is oMLX's per-model resident-bytes field — identical to what the fork's /engine/loaded endpoint reports (commit 373d09b: memory_bytes = actual_size). config_model_type=qwen3_5 (Gated-DeltaNet / linear-attention hybrid), so the recurrent state is ctx-independent and resident memory does not scale with context length — the linear-attention calibration datapoint issue #2 asked for. ctx=32768 = oMLX global default max_context_window (per-model setting null -> inherits default, omlx/server.py:244 + model_settings.py:38). kvBits=16 from the loaded engine's settings (turboquant_kv_enabled=false -> unquantized fp16 KV). Idle measurement (no active generation); excludes generation-time activation growth, so treat as floor not peak-during-gen. Reported in GiB to match issue #2's convention (decimal-GB equivalent: 16.46). NOTE: this is the 4-bit variant — the only Qwen3.6-27B resident at measurement time; the oQ8-mtp (8-bit) variant was registered but NOT loaded, so no number is reported for it. The source URL is the fork PR and resolves once opened; repoint to the upstream PR URL if preferred.",
    "evidenceLevel": "community_unverified",
    "reporter": "gilbert-barajas"
  },
  {
    "model": "Qwen 3.6 27B",
    "device": "M5 Max 128GB",
    "quant": "4bit",
    "ctx": 32768,
    "kvBits": 16,
    "measuredPeakGB": 15.34,
    "measurementKind": "idle_resident",
    "unit": "GiB",
    "includesOsReserve": false,
    "runtime": "oMLX 0.4.5.dev1 (MLX 0.31.2)",
    "source": "https://github.com/click6067-ship-it/fitllm-engine/pull/5",
    "date": "2026-07-09",
    "notes": "Measured resident bytes via oMLX /admin/api/models actual_size = 16,474,582,728 B = 15.34 GiB (16.47 GB decimal), M5 Max 128GB. config_model_type=qwen3_5. qwen3_5 Gated-DeltaNet linear-attention hybrid; recurrent state ctx-independent. Reproduces PR#4's 15.33. Idle measurement (weights resident, no active generation) -- floor, not peak-during-gen. ctx=32768 & kvBits=16 are oMLX defaults. Reported in GiB to match existing fixtures.",
    "evidenceLevel": "community_unverified",
    "reporter": "gilbert-barajas"
  },
  {
    "model": "Qwen 3.6 27B",
    "device": "M5 Max 128GB",
    "quant": "8bit",
    "ctx": 32768,
    "kvBits": 16,
    "measuredPeakGB": 27.86,
    "measurementKind": "idle_resident",
    "unit": "GiB",
    "includesOsReserve": false,
    "runtime": "oMLX 0.4.5.dev1 (MLX 0.31.2)",
    "source": "https://github.com/click6067-ship-it/fitllm-engine/pull/5",
    "date": "2026-07-09",
    "notes": "Measured resident bytes via oMLX /admin/api/models actual_size = 29,912,487,056 B = 27.86 GiB (29.91 GB decimal), M5 Max 128GB. config_model_type=qwen3_5. qwen3_5 Gated-DeltaNet; 8-bit (oQ8) with MTP head; NEW quant point. Idle measurement (weights resident, no active generation) -- floor, not peak-during-gen. ctx=32768 & kvBits=16 are oMLX defaults. Reported in GiB to match existing fixtures.",
    "evidenceLevel": "community_unverified",
    "reporter": "gilbert-barajas"
  },
  {
    "model": "Qwen 3.6 35B-A3B",
    "device": "M5 Max 128GB",
    "quant": "4bit",
    "ctx": 32768,
    "kvBits": 16,
    "measuredPeakGB": 18.08,
    "measurementKind": "idle_resident",
    "unit": "GiB",
    "includesOsReserve": false,
    "runtime": "oMLX 0.4.5.dev1 (MLX 0.31.2)",
    "source": "https://github.com/click6067-ship-it/fitllm-engine/pull/5",
    "date": "2026-07-09",
    "notes": "Measured resident bytes via oMLX /admin/api/models actual_size = 19,408,091,008 B = 18.08 GiB (19.41 GB decimal), M5 Max 128GB. config_model_type=qwen3_5_moe. qwen3_5_moe 35B-A3B (OSU-NLP QUEST-RL); catalog name is nearest match by params. Idle measurement (weights resident, no active generation) -- floor, not peak-during-gen. ctx=32768 & kvBits=16 are oMLX defaults. Reported in GiB to match existing fixtures.",
    "evidenceLevel": "community_unverified",
    "reporter": "gilbert-barajas"
  },
  {
    "model": "Qwen3-4B-Instruct-2507",
    "device": "M5 Max 128GB",
    "quant": "4bit",
    "ctx": 32768,
    "kvBits": 16,
    "measuredPeakGB": 2.09,
    "measurementKind": "idle_resident",
    "unit": "GiB",
    "includesOsReserve": false,
    "runtime": "oMLX 0.4.5.dev1 (MLX 0.31.2)",
    "source": "https://github.com/click6067-ship-it/fitllm-engine/pull/5",
    "date": "2026-07-09",
    "notes": "Measured resident bytes via oMLX /admin/api/models actual_size = 2,246,903,416 B = 2.09 GiB (2.25 GB decimal), M5 Max 128GB. config_model_type=qwen3. qwen3 4B dense; not in catalog. Idle measurement (weights resident, no active generation) -- floor, not peak-during-gen. ctx=32768 & kvBits=16 are oMLX defaults. Reported in GiB to match existing fixtures. (not in the built-in catalog -- no fitllm prediction paired here.)",
    "evidenceLevel": "community_unverified",
    "reporter": "gilbert-barajas"
  },
  {
    "model": "Qwen3-Coder-30B-A3B-Instruct",
    "device": "M5 Max 128GB",
    "quant": "8bit",
    "ctx": 32768,
    "kvBits": 16,
    "measuredPeakGB": 30.17,
    "measurementKind": "idle_resident",
    "unit": "GiB",
    "includesOsReserve": false,
    "runtime": "oMLX 0.4.5.dev1 (MLX 0.31.2)",
    "source": "https://github.com/click6067-ship-it/fitllm-engine/pull/5",
    "date": "2026-07-09",
    "notes": "Measured resident bytes via oMLX /admin/api/models actual_size = 32,393,780,000 B = 30.17 GiB (32.39 GB decimal), M5 Max 128GB. config_model_type=qwen3_moe. qwen3_moe 30B-A3B coder; dFlash SSD expert offload (active experts resident). Matches issue #2's 30.4. Idle measurement (weights resident, no active generation) -- floor, not peak-during-gen. ctx=32768 & kvBits=16 are oMLX defaults. Reported in GiB to match existing fixtures. (not in the built-in catalog -- no fitllm prediction paired here.)",
    "evidenceLevel": "community_unverified",
    "reporter": "gilbert-barajas"
  },
  {
    "model": "Qwen3-Coder-Next (elastic)",
    "device": "M5 Max 128GB",
    "quant": "8bit",
    "ctx": 32768,
    "kvBits": 16,
    "measuredPeakGB": 52.58,
    "measurementKind": "idle_resident",
    "unit": "GiB",
    "includesOsReserve": false,
    "runtime": "oMLX 0.4.5.dev1 (MLX 0.31.2)",
    "source": "https://github.com/click6067-ship-it/fitllm-engine/pull/5",
    "date": "2026-07-09",